{
  "$schema": "https://json-schema.org/draft/2020-12/schema",
  "$id": "https://raw.githubusercontent.com/dineug/erd-editor/main/json-schema/schema.json",
  "title": "ERD Editor document",
  "description": "The storage form an ERD Editor file holds (.erd, .erd.json, .vuerd, .vuerd.json): the live entities alone, each collection keyed in id order but the dictionaries, a header and one row per entry in document order, without what an editor derives on load or keeps while it is open, without an entity's text field while it is empty, which reads as the empty string, and without an empty list or collection, which reads as none",
  "type": "object",
  "properties": {
    "$schema": {
      "type": "string"
    },
    "version": {
      "description": "Version of the schema",
      "const": "3.0.0"
    },
    "settings": {
      "$ref": "#/$defs/settings"
    },
    "doc": {
      "$ref": "#/$defs/doc"
    },
    "collections": {
      "description": "The entities of each kind, a kind with none left out",
      "type": "object",
      "properties": {
        "tableEntities": {
          "$ref": "#/$defs/tableEntities"
        },
        "tableColumnEntities": {
          "$ref": "#/$defs/tableColumnEntities"
        },
        "relationshipEntities": {
          "$ref": "#/$defs/relationshipEntities"
        },
        "indexEntities": {
          "$ref": "#/$defs/indexEntities"
        },
        "indexColumnEntities": {
          "$ref": "#/$defs/indexColumnEntities"
        },
        "memoEntities": {
          "$ref": "#/$defs/memoEntities"
        },
        "tableGroupEntities": {
          "$ref": "#/$defs/tableGroupEntities"
        },
        "wordEntities": {
          "$ref": "#/$defs/wordEntities"
        },
        "termEntities": {
          "$ref": "#/$defs/termEntities"
        },
        "domainEntities": {
          "$ref": "#/$defs/domainEntities"
        }
      },
      "additionalProperties": false
    }
  },
  "required": ["$schema", "version", "settings", "doc"],
  "additionalProperties": false,
  "$defs": {
    "settings": {
      "type": "object",
      "properties": {
        "originX": {
          "type": "number"
        },
        "originY": {
          "type": "number"
        },
        "zoomLevel": {
          "type": "number",
          "minimum": 0.1,
          "maximum": 1.5
        },
        "show": {
          "description": "bit value (tableComment: 1) | (columnComment: 2) | (columnDataType: 4) | (columnDefault: 8) | (columnAutoIncrement: 16) | (columnPrimaryKey: 32) | (columnUnique: 64) | (columnNotNull: 128) | (relationship: 256) | (columnAlternateKey: 512) | (hideReferentialAction: 1024) | (hideTableGroup: 2048) | (hideMemo: 4096) | (columnDomain: 8192); the three hide bits hide what they name while set",
          "type": "integer"
        },
        "database": {
          "description": "bit value (MariaDB: 1) | (MSSQL: 2) | (MySQL: 4) | (Oracle: 8) | (PostgreSQL: 16) | (SQLite: 32) | (Databricks: 64) | (Snowflake: 128)",
          "type": "integer",
          "enum": [1, 2, 4, 8, 16, 32, 64, 128]
        },
        "databaseName": {
          "type": "string"
        },
        "canvasType": {
          "enum": [
            "ERD",
            "@dineug/erd-editor/builtin-visualization",
            "@dineug/erd-editor/builtin-schema-sql",
            "@dineug/erd-editor/builtin-generator-code",
            "settings",
            "@dineug/erd-editor/builtin-dictionary"
          ]
        },
        "language": {
          "description": "bit value (GraphQL: 1) | (csharp: 2) | (Java: 4) | (Kotlin: 8) | (TypeScript: 16) | (JPA: 32) | (Scala: 64) | (Go: 128) | (SQLAlchemy: 256) | (TypeORM: 512) | (Sequelize: 1024) | (Drizzle: 2048) | (DBML: 4096) | (AML: 8192) | (Mermaid: 16384) | (PHP: 32768) | (Doctrine: 65536) | (Rust: 131072) | (SeaORM: 262144) | (Swift: 524288) | (Zod: 1048576) | (JSONSchema: 2097152)",
          "type": "integer",
          "enum": [1, 2, 4, 8, 16, 32, 64, 128, 256, 512, 1024, 2048, 4096, 8192, 16384, 32768, 65536, 131072, 262144, 524288, 1048576, 2097152]
        },
        "tableNameCase": {
          "description": "bit value (none: 1) | (camelCase: 2) | (pascalCase: 4) | (snakeCase: 8)",
          "type": "integer",
          "enum": [1, 2, 4, 8]
        },
        "columnNameCase": {
          "description": "bit value (none: 1) | (camelCase: 2) | (pascalCase: 4) | (snakeCase: 8)",
          "type": "integer",
          "enum": [1, 2, 4, 8]
        },
        "bracketType": {
          "description": "bit value (none: 1) | (doubleQuote: 2) | (singleQuote: 4) | (backtick: 8)",
          "type": "integer",
          "enum": [1, 2, 4, 8]
        },
        "relationshipDataTypeSync": {
          "type": "boolean"
        },
        "columnOrder": {
          "description": "bit value (columnName: 1) | (columnDataType: 2) | (columnNotNull: 4) | (columnUnique: 8) | (columnAutoIncrement: 16) | (columnDefault: 32) | (columnComment: 64) | (columnLogicalName: 128) | (columnDomain: 256); seven entries without the last two while the logical name stands just before the name and the domain just after the data type, all nine otherwise",
          "type": "array",
          "prefixItems": [
            { "type": "integer" },
            { "type": "integer" },
            { "type": "integer" },
            { "type": "integer" },
            { "type": "integer" },
            { "type": "integer" },
            { "type": "integer" },
            { "type": "integer" },
            { "type": "integer" }
          ],
          "anyOf": [
            { "minItems": 7, "maxItems": 7 },
            { "minItems": 9, "maxItems": 9 }
          ]
        },
        "maxWidthComment": {
          "type": "integer"
        },
        "lockSettings": {
          "description": "bit value (viewport: 1) | (canvasType: 2) | (language: 4) | (tableNameCase: 8) | (columnNameCase: 16) | (bracketType: 32) | (unlockNameViewMode: 64); a locked setting is saved as it stood when locked, the viewport being originX, originY and zoomLevel. The last bit reads the other way round: set, the name view mode is unlocked, and clear, as in a file saved before it, locked",
          "type": "integer"
        },
        "ddlScripts": {
          "description": "SQL the Schema SQL writes as is for every database: before after the header and ahead of the tables, after past the generated DDL. Absent while both are empty",
          "type": "object",
          "properties": {
            "before": { "type": "string" },
            "after": { "type": "string" }
          },
          "required": ["before", "after"],
          "additionalProperties": false
        },
        "nameViewMode": {
          "description": "The names the diagram shows: the logical ones, or both the physical and the logical. Absent while it shows the physical names, the default",
          "enum": ["logical", "both"]
        }
      },
      "required": [
        "originX",
        "originY",
        "zoomLevel",
        "show",
        "database",
        "databaseName",
        "canvasType",
        "language",
        "tableNameCase",
        "columnNameCase",
        "bracketType",
        "relationshipDataTypeSync",
        "columnOrder",
        "maxWidthComment",
        "lockSettings"
      ],
      "additionalProperties": false
    },
    "doc": {
      "description": "The order of each kind of entity, which the DDL, the sort and the draw order read, a kind with none left out. A list goes out whenever its collection holds an entity, since a reader that finds none lists none",
      "type": "object",
      "properties": {
        "tableIds": {
          "type": "array",
          "items": {
            "type": "string"
          }
        },
        "relationshipIds": {
          "type": "array",
          "items": {
            "type": "string"
          }
        },
        "indexIds": {
          "type": "array",
          "items": {
            "type": "string"
          }
        },
        "memoIds": {
          "type": "array",
          "items": {
            "type": "string"
          }
        },
        "tableGroupIds": {
          "description": "Order of the table groups. Written while a group exists; absent means none",
          "type": "array",
          "items": {
            "type": "string"
          }
        }
      },
      "additionalProperties": false
    },
    "tableEntities": {
      "type": "object",
      "additionalProperties": {
        "type": "object",
        "properties": {
          "id": {
            "type": "string"
          },
          "name": {
            "type": "string"
          },
          "logicalName": {
            "description": "The name the logical view shows; absent means none",
            "type": "string"
          },
          "comment": {
            "type": "string"
          },
          "columnIds": {
            "type": "array",
            "items": {
              "type": "string"
            }
          },
          "groupId": {
            "description": "Id of the table group in doc.tableGroupIds the table belongs to; absent means none",
            "type": "string"
          },
          "nameDerived": {
            "description": "The dictionaries filled the name, so a new logical name derives it again; absent means a name someone wrote",
            "type": "boolean",
            "const": true
          },
          "ui": {
            "type": "object",
            "properties": {
              "x": {
                "type": "number"
              },
              "y": {
                "type": "number"
              },
              "color": {
                "type": "string"
              }
            },
            "required": ["x", "y"],
            "additionalProperties": false
          }
        },
        "required": ["id", "columnIds", "ui"],
        "additionalProperties": false
      }
    },
    "tableColumnEntities": {
      "type": "object",
      "additionalProperties": {
        "type": "object",
        "properties": {
          "id": {
            "type": "string"
          },
          "tableId": {
            "type": "string"
          },
          "name": {
            "type": "string"
          },
          "comment": {
            "type": "string"
          },
          "dataType": {
            "type": "string"
          },
          "default": {
            "type": "string"
          },
          "options": {
            "description": "bit value (autoIncrement: 1) | (primaryKey: 2) | (unique: 4) | (notNull: 8) | (nameDerived: 16); nameDerived is set while the dictionaries filled the name",
            "type": "integer"
          },
          "logicalName": {
            "description": "The name the logical view shows; absent means none",
            "type": "string"
          },
          "domainId": {
            "description": "Id of the domain in domainEntities that governs the data type; absent means none",
            "type": "string"
          }
        },
        "required": ["id", "tableId", "options"],
        "additionalProperties": false
      }
    },
    "relationshipEntities": {
      "type": "object",
      "additionalProperties": {
        "type": "object",
        "properties": {
          "id": {
            "type": "string"
          },
          "relationshipType": {
            "description": "bit value (ZeroOne: 2) | (ZeroN: 4) | (OneOnly: 8) | (OneN: 16)",
            "type": "integer"
          },
          "onDelete": {
            "description": "bit value (none: 1) | (noAction: 2) | (cascade: 4) | (setNull: 8) | (setDefault: 16) | (restrict: 32); none, the default, writes no ON DELETE clause",
            "type": "integer"
          },
          "onUpdate": {
            "description": "bit value (none: 1) | (noAction: 2) | (cascade: 4) | (setNull: 8) | (setDefault: 16) | (restrict: 32); none, the default, writes no ON UPDATE clause",
            "type": "integer"
          },
          "start": {
            "$ref": "#/$defs/RelationshipPoint"
          },
          "end": {
            "$ref": "#/$defs/RelationshipPoint"
          }
        },
        "required": [
          "id",
          "relationshipType",
          "onDelete",
          "onUpdate",
          "start",
          "end"
        ],
        "additionalProperties": false
      }
    },
    "indexEntities": {
      "type": "object",
      "additionalProperties": {
        "type": "object",
        "properties": {
          "id": {
            "type": "string"
          },
          "name": {
            "type": "string"
          },
          "tableId": {
            "type": "string"
          },
          "indexColumnIds": {
            "type": "array",
            "items": {
              "type": "string"
            }
          },
          "unique": {
            "type": "boolean"
          }
        },
        "required": ["id", "tableId", "indexColumnIds", "unique"],
        "additionalProperties": false
      }
    },
    "indexColumnEntities": {
      "type": "object",
      "additionalProperties": {
        "type": "object",
        "properties": {
          "id": {
            "type": "string"
          },
          "indexId": {
            "type": "string"
          },
          "columnId": {
            "type": "string"
          },
          "orderType": {
            "description": "bit value (ASC: 1) | (DESC: 2)",
            "type": "integer"
          }
        },
        "required": ["id", "indexId", "columnId", "orderType"],
        "additionalProperties": false
      }
    },
    "memoEntities": {
      "type": "object",
      "additionalProperties": {
        "type": "object",
        "properties": {
          "id": {
            "type": "string"
          },
          "value": {
            "type": "string"
          },
          "ui": {
            "type": "object",
            "properties": {
              "x": {
                "type": "number"
              },
              "y": {
                "type": "number"
              },
              "width": {
                "type": "number"
              },
              "height": {
                "type": "number"
              },
              "color": {
                "type": "string"
              }
            },
            "required": ["x", "y", "width", "height"],
            "additionalProperties": false
          }
        },
        "required": ["id", "ui"],
        "additionalProperties": false
      }
    },
    "tableGroupEntities": {
      "description": "Named, coloured rectangles drawn behind tables; a table joins one through its groupId. Written while a group exists; absent means none",
      "type": "object",
      "additionalProperties": {
        "type": "object",
        "properties": {
          "id": {
            "type": "string"
          },
          "name": {
            "type": "string"
          },
          "color": {
            "type": "string"
          },
          "ui": {
            "type": "object",
            "properties": {
              "x": {
                "type": "number"
              },
              "y": {
                "type": "number"
              },
              "width": {
                "type": "number"
              },
              "height": {
                "type": "number"
              }
            },
            "required": ["x", "y", "width", "height"],
            "additionalProperties": false
          }
        },
        "required": ["id", "ui"],
        "additionalProperties": false
      }
    },
    "wordEntities": {
      "description": "The words of the dictionary, the parts a logical name is composed of, each with its abbreviation in a physical name. Written while a word exists; absent means none",
      "type": "object",
      "properties": {
        "fields": {
          "const": ["id", "name", "abbreviation", "englishName", "description", "synonyms", "forbiddenWords"]
        },
        "rows": {
          "description": "One row per entry in document order, its values in the order fields names them; values past the name are left out from the last empty one back",
          "type": "array",
          "items": {
            "type": "array",
            "prefixItems": [
              { "type": "string" },
              { "type": "string" },
              { "type": "string" },
              { "type": "string" },
              { "type": "string" },
              { "type": "string" },
              { "type": "string" }
            ],
            "items": false,
            "minItems": 2
          }
        }
      },
      "required": ["fields", "rows"],
      "additionalProperties": false
    },
    "termEntities": {
      "description": "The terms of the dictionary, logical names a column matches by its text, each with its physical name and domain id. Written while a term exists; absent means none",
      "type": "object",
      "properties": {
        "fields": {
          "const": ["id", "name", "physicalName", "domainId", "description", "synonyms"]
        },
        "rows": {
          "description": "One row per entry in document order, its values in the order fields names them; values past the name are left out from the last empty one back",
          "type": "array",
          "items": {
            "type": "array",
            "prefixItems": [
              { "type": "string" },
              { "type": "string" },
              { "type": "string" },
              { "type": "string" },
              { "type": "string" },
              { "type": "string" }
            ],
            "items": false,
            "minItems": 2
          }
        }
      },
      "required": ["fields", "rows"],
      "additionalProperties": false
    },
    "domainEntities": {
      "description": "The domains of the dictionary, named data types a column or a term links to by id. Written while a domain exists; absent means none",
      "type": "object",
      "properties": {
        "fields": {
          "const": ["id", "name", "category", "dataType", "description"]
        },
        "rows": {
          "description": "One row per entry in document order, its values in the order fields names them; values past the name are left out from the last empty one back",
          "type": "array",
          "items": {
            "type": "array",
            "prefixItems": [
              { "type": "string" },
              { "type": "string" },
              { "type": "string" },
              { "type": "string" },
              { "type": "string" }
            ],
            "items": false,
            "minItems": 2
          }
        }
      },
      "required": ["fields", "rows"],
      "additionalProperties": false
    },
    "RelationshipPoint": {
      "type": "object",
      "properties": {
        "tableId": {
          "type": "string"
        },
        "columnIds": {
          "type": "array",
          "items": {
            "type": "string"
          }
        }
      },
      "required": ["tableId", "columnIds"],
      "additionalProperties": false
    }
  }
}
