{
  "$schema": "https://raw.githubusercontent.com/dineug/erd-editor/main/json-schema/schema.json",
  "version": "3.0.0",
  "settings": {
    "originX": 0,
    "originY": 0,
    "zoomLevel": 1,
    "show": 431,
    "database": 4,
    "databaseName": "",
    "canvasType": "ERD",
    "language": 1,
    "tableNameCase": 4,
    "columnNameCase": 2,
    "bracketType": 1,
    "relationshipDataTypeSync": true,
    "columnOrder": [
      1,
      2,
      4,
      8,
      16,
      32,
      64
    ],
    "maxWidthComment": -1,
    "lockSettings": 63
  },
  "doc": {
    "tableIds": [],
    "relationshipIds": [],
    "indexIds": [],
    "memoIds": []
  },
  "collections": {
    "tableEntities": {},
    "tableColumnEntities": {},
    "relationshipEntities": {},
    "indexEntities": {},
    "indexColumnEntities": {},
    "memoEntities": {}
  }
}
